{
  "$schema": "../schemas/behaviours.schema.json",
  "version": 1,
  "description": "The kinds of behaviour a feature sheet describes with a card (:::behaviour, ARCHITECTURE.md §6.8a): for each kind, the rubrics a reader expects answered. A required rubric left out is reported (behaviour.missing); \"n/a — reason\" and \"unknown — question\" are answers. A project adds its own kinds with config.behaviours.file (same format, no `answers`).",
  "answers": {
    "na": ["n/a", "not applicable", "sans objet", "non applicable"],
    "unknown": ["unknown", "to confirm", "to be confirmed", "inconnu", "inconnue", "à confirmer"]
  },
  "kinds": [
    {
      "id": "search",
      "aliases": ["recherche"],
      "title": { "en": "Search", "fr": "Recherche" },
      "icon": "search",
      "rubrics": [
        { "id": "where", "label": { "en": "Where", "fr": "Où" }, "required": true, "hint": { "en": "The field, its label and placeholder, and where it sits on the screen.", "fr": "Le champ, son libellé et son texte d'aide, et où il se trouve à l'écran." } },
        { "id": "fields", "label": { "en": "Fields searched", "fr": "Champs cherchés" }, "aliases": { "en": ["Searched fields"], "fr": ["Champs recherchés"] }, "required": true, "hint": { "en": "Which data the typed text is compared with, and which it is not (an order number, an amount…).", "fr": "Les données comparées au texte tapé, et celles qui ne le sont pas (un numéro de commande, un montant…)." } },
        { "id": "match", "label": { "en": "Matching", "fr": "Correspondance" }, "required": true, "hint": { "en": "Contains, starts with or exact; whether case and accents count, with an example of each.", "fr": "Contient, commence par ou exact ; si les majuscules et les accents comptent, avec un exemple de chaque." } },
        { "id": "words", "label": { "en": "Several words", "fr": "Plusieurs mots" }, "required": true, "hint": { "en": "How a text of several words is read: one phrase, every word, or any of the words.", "fr": "Comment se lit un texte de plusieurs mots : une seule expression, tous les mots, ou l'un des mots." } },
        { "id": "trigger", "label": { "en": "Trigger", "fr": "Déclenchement" }, "required": true, "hint": { "en": "At each keystroke, on Enter or with a button; any delay or minimum length; spaces at the ends.", "fr": "À chaque frappe, sur Entrée ou avec un bouton ; un délai ou une longueur minimale ; les espaces aux extrémités." } },
        { "id": "filters", "label": { "en": "Combined filters", "fr": "Filtres associés" }, "required": false, "hint": { "en": "Whether it combines with the screen's filters, and how (every condition, or any).", "fr": "S'il se combine avec les filtres de l'écran, et comment (toutes les conditions, ou l'une)." } },
        { "id": "order", "label": { "en": "Order of results", "fr": "Ordre des résultats" }, "aliases": { "en": ["Sort", "Order"], "fr": ["Tri", "Ordre"] }, "required": true, "hint": { "en": "In which order the results come, and whether the reader can change it.", "fr": "Dans quel ordre viennent les résultats, et si le lecteur peut le changer." } },
        { "id": "paging", "label": { "en": "Pagination", "fr": "Pagination" }, "required": false, "hint": { "en": "How many results at once, and how to see the next ones.", "fr": "Combien de résultats à la fois, et comment voir les suivants." } },
        { "id": "empty", "label": { "en": "No result", "fr": "Aucun résultat" }, "required": true, "hint": { "en": "What the reader sees when nothing matches.", "fr": "Ce que voit le lecteur quand rien ne correspond." } },
        { "id": "errors", "label": { "en": "Errors", "fr": "Erreurs" }, "required": false, "hint": { "en": "What the reader sees when the search cannot be done.", "fr": "Ce que voit le lecteur quand la recherche ne peut pas se faire." } },
        { "id": "rights", "label": { "en": "Permissions", "fr": "Droits" }, "required": true, "hint": { "en": "Who can search, and whether the results are limited to what the reader may see.", "fr": "Qui peut chercher, et si les résultats se limitent à ce que le lecteur a le droit de voir." } }
      ]
    },
    {
      "id": "filter",
      "aliases": ["filtre"],
      "title": { "en": "Filter", "fr": "Filtre" },
      "icon": "filter",
      "rubrics": [
        { "id": "criteria", "label": { "en": "Criteria", "fr": "Critères" }, "required": true, "hint": { "en": "Each criterion, the values it offers and how it compares (exact value, range, one day).", "fr": "Chaque critère, les valeurs proposées et la façon de comparer (valeur exacte, intervalle, un seul jour)." } },
        { "id": "combination", "label": { "en": "Combination", "fr": "Combinaison" }, "required": true, "hint": { "en": "How criteria combine with each other and with the search; several values of one criterion.", "fr": "Comment les critères se combinent entre eux et avec la recherche ; plusieurs valeurs d'un même critère." } },
        { "id": "default", "label": { "en": "Default", "fr": "Par défaut" }, "required": true, "hint": { "en": "The value of each criterion when the screen opens.", "fr": "La valeur de chaque critère à l'ouverture de l'écran." } },
        { "id": "trigger", "label": { "en": "Trigger", "fr": "Déclenchement" }, "required": true, "hint": { "en": "Applied as soon as a value changes, or with a button.", "fr": "Appliqué dès qu'une valeur change, ou avec un bouton." } },
        { "id": "reset", "label": { "en": "Reset", "fr": "Remise à zéro" }, "required": false, "hint": { "en": "How to go back to no filter.", "fr": "Comment revenir à aucun filtre." } },
        { "id": "memory", "label": { "en": "Remembered", "fr": "Conservation" }, "required": false, "hint": { "en": "Whether the filters are kept on leaving the screen, on reloading, in a shared link.", "fr": "Si les filtres restent en quittant l'écran, en rechargeant, dans un lien partagé." } },
        { "id": "effect", "label": { "en": "Effect", "fr": "Effet" }, "required": false, "hint": { "en": "What else follows the filters: counters, totals, an export.", "fr": "Ce qui suit aussi les filtres : compteurs, totaux, un export." } },
        { "id": "empty", "label": { "en": "No result", "fr": "Aucun résultat" }, "required": true, "hint": { "en": "What the reader sees when no item is left.", "fr": "Ce que voit le lecteur quand il ne reste aucun élément." } },
        { "id": "rights", "label": { "en": "Permissions", "fr": "Droits" }, "required": false, "hint": { "en": "Whether some criteria or values depend on the reader's rights.", "fr": "Si certains critères ou valeurs dépendent des droits du lecteur." } }
      ]
    },
    {
      "id": "sort",
      "aliases": ["tri"],
      "title": { "en": "Sort", "fr": "Tri" },
      "icon": "sort",
      "rubrics": [
        { "id": "default", "label": { "en": "Default order", "fr": "Ordre par défaut" }, "required": true, "hint": { "en": "The order of the items when the screen opens.", "fr": "L'ordre des éléments à l'ouverture de l'écran." } },
        { "id": "columns", "label": { "en": "Sortable by", "fr": "Triable par" }, "required": true, "hint": { "en": "What the reader can sort on, and how they do it (a column header, a menu).", "fr": "Ce sur quoi le lecteur peut trier, et comment (un en-tête de colonne, un menu)." } },
        { "id": "direction", "label": { "en": "Direction", "fr": "Sens" }, "required": false, "hint": { "en": "Ascending or descending, and how to switch.", "fr": "Croissant ou décroissant, et comment passer de l'un à l'autre." } },
        { "id": "ties", "label": { "en": "Ties", "fr": "Égalités" }, "required": false, "hint": { "en": "The order of the items that have the same value.", "fr": "L'ordre des éléments qui ont la même valeur." } },
        { "id": "text", "label": { "en": "Text order", "fr": "Ordre du texte" }, "required": false, "hint": { "en": "Case, accents, and numbers inside text (does 2 come before 10?).", "fr": "Majuscules, accents, et nombres dans le texte (2 vient-il avant 10 ?)." } },
        { "id": "memory", "label": { "en": "Remembered", "fr": "Conservation" }, "required": false, "hint": { "en": "Whether the chosen order is kept on leaving the screen.", "fr": "Si l'ordre choisi reste en quittant l'écran." } }
      ]
    },
    {
      "id": "pagination",
      "aliases": ["pages"],
      "title": { "en": "Pagination", "fr": "Pagination" },
      "icon": "pages",
      "rubrics": [
        { "id": "size", "label": { "en": "Page size", "fr": "Taille de page" }, "required": true, "hint": { "en": "How many items a page holds, and whether the reader can change it.", "fr": "Combien d'éléments tient une page, et si le lecteur peut le changer." } },
        { "id": "navigation", "label": { "en": "Navigation", "fr": "Navigation" }, "required": true, "hint": { "en": "Numbered pages, next and previous, \"load more\", or endless scrolling.", "fr": "Pages numérotées, suivante et précédente, « afficher plus », ou défilement sans fin." } },
        { "id": "total", "label": { "en": "Total", "fr": "Total" }, "required": false, "hint": { "en": "Whether the total number of items is shown.", "fr": "Si le nombre total d'éléments est affiché." } },
        { "id": "reset", "label": { "en": "Back to the start", "fr": "Retour au début" }, "required": true, "hint": { "en": "What happens to the current page when the search, the filters or the order change.", "fr": "Ce que devient la page en cours quand la recherche, les filtres ou l'ordre changent." } },
        { "id": "limit", "label": { "en": "Maximum", "fr": "Maximum" }, "required": false, "hint": { "en": "A cap on the items that can be reached, if any.", "fr": "Une limite au nombre d'éléments accessibles, s'il y en a une." } }
      ]
    },
    {
      "id": "list",
      "aliases": ["liste"],
      "title": { "en": "List", "fr": "Liste" },
      "icon": "list",
      "rubrics": [